{
  "$schema": "https://json-schema.org/draft/2020-12/schema",
  "$id": "https://faceguard-evidence.local/schemas/source-metadata.schema.json",
  "title": "FaceGuard Evidence source snapshot metadata",
  "type": "object",
  "additionalProperties": false,
  "required": [
    "schema_version",
    "source_id",
    "title",
    "source_category",
    "publisher",
    "authors",
    "version",
    "published_at",
    "canonical_url",
    "retrieved_at",
    "license",
    "original",
    "normalized",
    "normalization"
  ],
  "properties": {
    "schema_version": {
      "const": 1
    },
    "source_id": {
      "type": "string",
      "pattern": "^[A-Z]+-[A-Z]+-[0-9]{3}$"
    },
    "title": {
      "type": "string",
      "minLength": 1
    },
    "source_category": {
      "type": "string",
      "minLength": 1
    },
    "publisher": {
      "type": "string",
      "minLength": 1
    },
    "authors": {
      "type": "array",
      "minItems": 1,
      "items": {
        "type": "string",
        "minLength": 1
      }
    },
    "version": {
      "type": "string",
      "minLength": 1
    },
    "published_at": {
      "type": "string",
      "format": "date"
    },
    "canonical_url": {
      "type": "string",
      "format": "uri"
    },
    "content_path": {
      "type": "string",
      "minLength": 1
    },
    "retrieved_at": {
      "type": "string",
      "format": "date-time"
    },
    "license": {
      "type": "object",
      "additionalProperties": false,
      "required": [
        "name",
        "url",
        "rights_basis"
      ],
      "properties": {
        "name": {
          "type": "string",
          "minLength": 1
        },
        "url": {
          "type": "string",
          "format": "uri"
        },
        "rights_basis": {
          "type": "string",
          "minLength": 1
        }
      }
    },
    "original": {
      "type": "object",
      "additionalProperties": false,
      "required": [
        "media_type",
        "bytes",
        "sha256"
      ],
      "properties": {
        "media_type": {
          "type": "string",
          "minLength": 1
        },
        "bytes": {
          "type": "integer",
          "minimum": 1
        },
        "sha256": {
          "$ref": "#/$defs/sha256"
        }
      }
    },
    "normalized": {
      "type": "object",
      "additionalProperties": false,
      "required": [
        "format",
        "bytes",
        "lines",
        "sha256"
      ],
      "properties": {
        "format": {
          "const": "markdown"
        },
        "bytes": {
          "type": "integer",
          "minimum": 1
        },
        "lines": {
          "type": "integer",
          "minimum": 1
        },
        "sha256": {
          "$ref": "#/$defs/sha256"
        }
      }
    },
    "normalization": {
      "type": "object",
      "additionalProperties": false,
      "required": [
        "tool",
        "tool_version",
        "dependencies",
        "steps"
      ],
      "properties": {
        "tool": {
          "type": "string",
          "minLength": 1
        },
        "tool_version": {
          "type": "string",
          "minLength": 1
        },
        "dependencies": {
          "type": "object",
          "additionalProperties": {
            "type": "string",
            "minLength": 1
          }
        },
        "steps": {
          "type": "array",
          "minItems": 1,
          "items": {
            "type": "string",
            "minLength": 1
          }
        }
      }
    }
  },
  "$defs": {
    "sha256": {
      "type": "string",
      "pattern": "^[A-F0-9]{64}$"
    }
  }
}
