{
  "schema_version": 1,
  "source_id": "FG-DOC-002",
  "title": "FaceGuard Evidence Experiment Log",
  "source_category": "measured_evaluation_evidence",
  "publisher": "FaceGuard Evidence",
  "authors": [
    "Tan Yan Yi"
  ],
  "version": "sha256:0621346F3401C42C62756AA7B8DCFC60E84C376B2520AD51D1BA0145A82D0B71",
  "published_at": "2026-10-06",
  "canonical_url": "repo:///docs/EXPERIMENTS.md",
  "content_path": "docs/EXPERIMENTS.md",
  "retrieved_at": "2026-10-06T16:20:49+00:00",
  "license": {
    "name": "FaceGuard Evidence project documentation",
    "url": "repo:///ATTRIBUTION.md",
    "rights_basis": "Tan-authored measured experiment records with restricted inputs and secrets excluded."
  },
  "original": {
    "media_type": "text/markdown",
    "bytes": 28783,
    "sha256": "0621346F3401C42C62756AA7B8DCFC60E84C376B2520AD51D1BA0145A82D0B71"
  },
  "normalized": {
    "format": "markdown",
    "bytes": 28783,
    "lines": 721,
    "sha256": "0621346F3401C42C62756AA7B8DCFC60E84C376B2520AD51D1BA0145A82D0B71"
  },
  "normalization": {
    "tool": "none",
    "tool_version": "1",
    "dependencies": {},
    "steps": [
      "Load the canonical committed UTF-8 Markdown file without transformation."
    ]
  }
}
