{
  "schema_version": 1,
  "source_id": "FG-DOC-003",
  "title": "FaceGuard Attribution Record",
  "source_category": "project_provenance",
  "publisher": "FaceGuard Evidence",
  "authors": [
    "Tan Yan Yi"
  ],
  "version": "sha256:B9F1C636C3729247120E8F0EAAD6A3212CDAB70EFC9F8BC0001A97393162132D",
  "published_at": "2026-10-06",
  "canonical_url": "repo:///ATTRIBUTION.md",
  "content_path": "ATTRIBUTION.md",
  "retrieved_at": "2026-10-06T16:20:49+00:00",
  "license": {
    "name": "FaceGuard Evidence project documentation",
    "url": "repo:///ATTRIBUTION.md",
    "rights_basis": "Tan-authored provenance record preserving original MCS24 Team attribution and reported permissions."
  },
  "original": {
    "media_type": "text/markdown",
    "bytes": 2810,
    "sha256": "B9F1C636C3729247120E8F0EAAD6A3212CDAB70EFC9F8BC0001A97393162132D"
  },
  "normalized": {
    "format": "markdown",
    "bytes": 2810,
    "lines": 67,
    "sha256": "B9F1C636C3729247120E8F0EAAD6A3212CDAB70EFC9F8BC0001A97393162132D"
  },
  "normalization": {
    "tool": "none",
    "tool_version": "1",
    "dependencies": {},
    "steps": [
      "Load the canonical committed UTF-8 Markdown file without transformation."
    ]
  }
}
