{
  "schema_version": 1,
  "source_id": "FG-DOC-001",
  "title": "FaceGuard vit3 Model Card",
  "source_category": "model_documentation",
  "publisher": "FaceGuard Evidence",
  "authors": [
    "Tan Yan Yi"
  ],
  "version": "1e9cd4c22e147c2f25e848b6456ed315c15fc625",
  "published_at": "2026-10-06",
  "canonical_url": "repo:///docs/MODEL_CARD.md",
  "content_path": "docs/MODEL_CARD.md",
  "retrieved_at": "2026-10-06T16:20:49+00:00",
  "license": {
    "name": "FaceGuard Evidence project documentation",
    "url": "repo:///ATTRIBUTION.md",
    "rights_basis": "Tan-authored documentation with original MCS24 Team and third-party provenance retained."
  },
  "original": {
    "media_type": "text/markdown",
    "bytes": 8994,
    "sha256": "5284318A3A8403ECBED991D78BC87039CE63FB09E995FB036FAE79D412C58862"
  },
  "normalized": {
    "format": "markdown",
    "bytes": 8994,
    "lines": 242,
    "sha256": "5284318A3A8403ECBED991D78BC87039CE63FB09E995FB036FAE79D412C58862"
  },
  "normalization": {
    "tool": "none",
    "tool_version": "1",
    "dependencies": {},
    "steps": [
      "Load the canonical committed UTF-8 Markdown file without transformation."
    ]
  }
}
